{"bundle_format":"bundle-manifest/proxy-v0","bundle_members_digest":"3333333333333333333333333333333333333333333333333333333333333333","calibration_digest":"8888888888888888888888888888888888888888888888888888888888888888","conformance_digest":"9999999999999999999999999999999999999999999999999999999999999999","dataset_publication":{"payload_digest":"5555555555555555555555555555555555555555555555555555555555555555","revision":"4444444444444444444444444444444444444444","source_locator":"SeniorAILab/synthetic"},"evaluation_receipt_digest":"6666666666666666666666666666666666666666666666666666666666666666","field_evaluation_receipt_digest":"7777777777777777777777777777777777777777777777777777777777777777","input_observation_schema":"pose-observation/v1","model_publication":{"bundle_sha256":"2222222222222222222222222222222222222222222222222222222222222222","revision":"1111111111111111111111111111111111111111","source_locator":"SeniorAILab/synthetic"},"output_class_count":2,"output_class_semantics_digest":"aaaaaaaaaaaaaaaaaaaaaaaaaaaaaaaaaaaaaaaaaaaaaaaaaaaaaaaaaaaaaaaa","policy_digest":"bbbbbbbbbbbbbbbbbbbbbbbbbbbbbbbbbbbbbbbbbbbbbbbbbbbbbbbbbbbbbbbb","preprocessing_identity":"coco17-xyc-plus-pose-head-xyxy-valid-f32-v1","runtime_format":"onnxruntime","schema_version":2,"threshold_source":"default","transition_threshold":0.5}
